requirement,implemented file,relevant line or section,automated test,status,notes
"The three supplied protocol documents are stored separately","docs/research_reset_protocol_v1.md; docs/repository_migration_plan.md; docs/eligibility_audit_plan.md","Top-level titles and numbered sections","GovernanceTests.test_protocol_documents_have_expected_topology",implemented,"Topology is automated; normalized source equality was manually checked during Phase 1 and is not claimed as a repeatable repository-only test"
"README limits the current work to research foundation phases","README.md","Current scope","GovernanceTests.test_readme_scope_is_phase_limited",implemented,"The test checks both authorized and prohibited scope statements"
"Repository skeleton and package metadata exist","pyproject.toml; src/vitaldb_state_selection; configs; docs; schemas; tests; data; outputs","Repository root and package directories","GovernanceTests.test_repository_skeleton_and_warning_documents_exist",implemented,"Only tracked placeholders exist in data and outputs"
"Large data checkpoints and generated outputs are excluded from Git",".gitignore","Raw and derived research data; model and experiment artifacts","GovernanceTests.test_gitignore_blocks_research_artifacts_but_not_manifests",implemented,"Small manifests remain eligible for version control"
"The repository has an executable test command","README.md; tests/test_governance.py","Quick checks; GovernanceTests","GovernanceTests.test_pyproject_declares_runtime_contract",implemented,"Uses standard unittest discovery; third-party runtime dependencies are declared"
"Legacy 98-case limitations are explicit","docs/legacy_98case_statement.md","Legacy 98-case Statement","GovernanceTests.test_repository_skeleton_and_warning_documents_exist",implemented,"Warning covers non-random sampling confirmatory limits inspected test and reconstructed environment"
"Claims do not describe an exact unpublished-code reproduction","docs/claim_boundary.md; docs/legacy_98case_statement.md","Claim Boundary; Legacy 98-case Statement","GovernanceTests.test_repository_skeleton_and_warning_documents_exist",implemented,"This verifies repository wording not scientific truth"
"Migration provenance has the required fields","docs/migration_provenance.csv","CSV header","GovernanceTests.test_migration_provenance_contract_is_exact",implemented,"Rows are intentionally absent until Phase 2 classification"
"Manifest schemas are syntactically valid JSON Schema","schemas/eligibility_manifest.schema.json; schemas/download_manifest.schema.json; schemas/signal_quality_manifest.schema.json","Schema roots and caseid constraints","GovernanceTests.test_json_schemas_are_valid_and_reject_invalid_identity",implemented,"Runtime manifest validation remains Phase 3 work"
"Quality thresholds are not assigned by code convenience","configs/eligibility_audit.yaml","quality_thresholds","GovernanceTests.test_audit_config_has_full_range_and_no_decided_thresholds",blocked_by_protocol,"Every numerical threshold is null and marked pending_human_review"
"Only explicitly protocol-approved track aliases are active","configs/track_aliases.yaml","aliases and pending_concepts","GovernanceTests.test_only_explicit_protocol_aliases_are_active",implemented,"New aliases require human review"
"Protocol v1.1 human approval fixes exact drug-rate labels, units, and concentrations","configs/track_aliases.yaml; docs/protocol_v1_1_decision_record.md","aliases; Exact track and unit decisions","EligibilityAuditTests.test_protocol_v1_1_track_units_are_human_validated",implemented,"PPF20_RATE is mL/hr at propofol 20 mg/mL and RFTN20_RATE is mL/hr at remifentanil 20 mcg/mL; RFTN50 is not merged or used"
"Legacy data split scaler checkpoint result and prediction artifacts are absent",".gitignore; data/manifests/.gitkeep; outputs/.gitkeep","Artifact ignore rules and placeholders","GovernanceTests.test_git_index_contains_no_data_dependent_artifacts",implemented,"The test inspects the Git index; Phase 2 inventory will separately classify legacy tracked artifacts"
"PK-PD prediction feature-selection and PPO implementations are not run or migrated","src/vitaldb_state_selection/pkpd/__init__.py; src/vitaldb_state_selection/prediction/__init__.py; src/vitaldb_state_selection/selection/__init__.py; src/vitaldb_state_selection/rl/__init__.py","Blocked package placeholders","GovernanceTests.test_blocked_research_packages_have_no_executable_implementation",blocked_by_protocol,"The test proves only that these packages contain no executable implementation at Phase 1"
"Phase failures record evidence instead of being hidden","PHASE_STATUS.md","Failure record template","GovernanceTests.test_phase_status_has_gate_and_failure_record_contract",implemented,"Actual failures must append a filled record"
"Every phase passes tests and self-review before advancing","PHASE_STATUS.md","Phase table and gate preamble","GovernanceTests.test_phase_status_has_gate_and_failure_record_contract",implemented,"The test verifies the gate contract only; executed test counts and manual self-review evidence are recorded per phase"
"Each phase is committed independently and pushed to origin main","PHASE_STATUS.md","Publication constraint and Phase 4 publication verification","",pending,"Phase commit SHAs were manually verified against the remote but external remote state has no honest repository-only automated test so this row remains pending"
"The legacy repository remains read-only","","","",pending,"Requires process and Git status evidence; not automatable from the new repository alone"
"Every legacy tracked file is classified before any code migration","docs/migration_provenance.csv; docs/legacy_source_snapshot.json","352 inventory rows and source snapshot","MigrationInventoryTests.test_inventory_has_exact_snapshot_coverage",implemented,"All tracked paths at source commit 9501b16 are present exactly once"
"Every migration row records source path commit SHA type dependency and tests","docs/migration_provenance.csv","All inventory rows","MigrationInventoryTests.test_every_row_has_complete_allowed_classification",implemented,"Non-rejected candidates remain pending revalidation"
"Migration type is one of copy refactor rewrite or reject","docs/migration_provenance.csv","migration_type column","MigrationInventoryTests.test_every_row_has_complete_allowed_classification",implemented,"No file is classified copy before independent revalidation"
"No legacy source code is copied before migration inventory completion","docs/migration_inventory_summary.md; tests/test_migration_inventory.py","Boundary; PHASE2_ALLOWED_FILES","MigrationInventoryTests.test_phase2_commit_contains_inventory_only",implemented,"Phase 2 diff is restricted to inventory documentation status and tests"
"Production audit configuration covers case IDs 1 through 6388","configs/eligibility_audit.yaml","expected_case_range","GovernanceTests.test_audit_config_has_full_range_and_no_decided_thresholds",implemented,"This validates configuration only not API completeness"
"Production code rejects first-N and arbitrary case limits","configs/eligibility_audit.yaml; src/vitaldb_state_selection/cohort/guards.py; src/vitaldb_state_selection/provenance/source_guard.py; scripts/verify_no_first_n_limit.py","Runtime and AST guards","FirstNGuardTests.test_production_source_guard_script_passes",implemented,"Engineering dry-run sampling is isolated from production entry points"
"All 6388 production cases receive exactly one manifest row","src/vitaldb_state_selection/cohort/eligibility.py; schemas/eligibility_manifest.schema.json; data/manifests/all_case_eligibility_manifest.csv","build_eligibility_records and actual Phase 5A manifest","FullMetadataAuditArtifactTests.test_manifest_has_exact_full_accounting_and_pending_decisions",implemented,"The actual production metadata manifest contains case IDs 1 through 6388 exactly once"
"Duplicate and missing case IDs fail validation","src/vitaldb_state_selection/cohort/guards.py; src/vitaldb_state_selection/cohort/eligibility.py","assert_manifest_complete; explicit failure rows","FirstNGuardTests.test_manifest_duplicate_and_missing_ids_are_rejected",implemented,"Missing source cases remain rows while malformed output manifests fail"
"Clinical metadata and track inventory are parsed for every case","src/vitaldb_state_selection/cohort/clinical_metadata.py; src/vitaldb_state_selection/cohort/track_inventory.py; data/manifests/metadata_audit_summary.json","parse_clinical_row; index_track_rows; actual Phase 5A counts","FullMetadataAuditArtifactTests.test_summary_recomputes_from_the_full_manifest",implemented,"All 6388 cases have clinical and track inventory source rows; ASA is missing in 133 cases and other reported clinical fields are complete"
"Download failures remain explicit manifest rows","src/vitaldb_state_selection/data/downloader.py; schemas/download_manifest.schema.json","DownloadManifestStore.initialize; DownloadOrchestrator.run","DownloaderTests.test_failure_case_remains_in_manifest",implemented,"All request rows are flushed before the first attempt"
"Downloads are resumable and checksums are verified before skipping","src/vitaldb_state_selection/data/downloader.py","_complete_and_verified","DownloaderTests.test_corrupt_completed_artifact_is_not_silently_skipped",implemented,"Corrupt completed artifacts consume a new bounded attempt"
"Manifest records are validated against schemas at runtime","src/vitaldb_state_selection/provenance/manifests.py; schemas/eligibility_manifest.schema.json; schemas/download_manifest.schema.json","validate_records; atomic CSV read/write","EligibilityAuditTests.test_manifest_round_trip_is_schema_validated",implemented,"Cross-record completeness is enforced separately"
"Synthetic tests cover resume failure logging duplicates and missing cases","tests/test_audit_framework.py; tests/test_downloader.py; tests/test_first_n_guard.py","EligibilityAuditTests; DownloaderTests; FirstNGuardTests","EligibilityAuditTests.test_source_query_failure_still_accounts_for_every_case",implemented,"Tests do not use legacy metrics or data artifacts"
"Metadata dry run samples 25 cases randomly with a fixed seed","scripts/run_engineering_dry_run.py; data/manifests/engineering_dry_run_seed_20260719/dry_run_manifest.csv; data/manifests/engineering_dry_run_seed_20260719/dry_run_summary.json","DRY_RUN_SEED and committed sample artifacts","DryRunArtifactTests.test_summary_is_fixed_random_engineering_only",implemented,"Universe was exactly 1 through 6388 and the sample is not first-25"
"Random 25-case signal dry run completes with checksums","data/manifests/engineering_dry_run_seed_20260719/download_manifest.csv; data/manifests/engineering_dry_run_seed_20260719/download_failures.jsonl","25 download rows with 12 complete and 13 explicit failures","DryRunArtifactTests.test_all_25_signal_outcomes_and_failures_are_preserved",implemented,"All 12 downloaded cases have checksums; missing exact-track cases were not silently excluded"
"Dry-run runtime storage and failure rate are recorded","docs/engineering_dry_run_report.md; data/manifests/engineering_dry_run_seed_20260719/dry_run_summary.json","Runtime and storage observations; summary metrics","DryRunArtifactTests.test_committed_artifact_checksums_match",implemented,"No full-production estimate is claimed because candidate count and units are pending"
"Dry-run output is labeled engineering-only and not a scientific result","README.md; docs/engineering_dry_run_report.md; data/manifests/engineering_dry_run_seed_20260719/dry_run_summary.json","Interpretation boundary and dry_run_label","DryRunArtifactTests.test_summary_is_fixed_random_engineering_only",implemented,"All later research execution flags remain false"
"Phase 5A records endpoint timestamps versions and source checksums","data/manifests/metadata_audit_source_snapshot.json; data/manifests/metadata_audit_artifact_checksums.json","Source endpoints configuration checksums and artifact inventory","FullMetadataAuditArtifactTests.test_source_snapshots_and_scope_are_phase5a_only",implemented,"Both metadata endpoints completed and exact response SHA-256 values are recorded"
"Phase 5A API source-row and manifest failures remain explicit","scripts/run_metadata_audit.py; src/vitaldb_state_selection/cohort/metadata_audit.py; data/manifests/metadata_audit_failures.jsonl","Endpoint events source-row preparation and manifest-row failure export","FullMetadataAuditTests.test_source_preparation_preserves_malformed_and_duplicate_track_events",implemented,"The actual Phase 5A failure log is present and empty because no API parsing missing-row or duplicate-row failure occurred"
"Unapproved track names are reported but never auto-approved","configs/track_aliases.yaml; data/manifests/unapproved_alias_candidates.csv; docs/full_metadata_track_inventory_audit_report.md","Three active exact names and 193 pending names","FullMetadataAuditArtifactTests.test_unapproved_names_are_all_pending_and_never_auto_approved",implemented,"Frequency is descriptive only and no candidate is assigned a concept or unit"
"Phase 5A reports metadata missingness and exact track combinations outcome-blind","data/manifests/metadata_audit_summary.json; docs/full_metadata_track_inventory_audit_report.md","Metadata missingness and approved exact-track combinations","FullMetadataAuditArtifactTests.test_summary_recomputes_from_the_full_manifest",implemented,"No BIS outcome distribution model result or threshold was used"
"Phase 5A does not access legacy IDs or execute downstream research","data/manifests/metadata_audit_source_snapshot.json; data/manifests/metadata_audit_summary.json","Scope and prohibited_execution","FullMetadataAuditArtifactTests.test_source_snapshots_and_scope_are_phase5a_only",implemented,"Legacy overlap and every downstream execution flag remain false or pending"
"Final signal-quality thresholds are chosen by human review","configs/eligibility_audit.yaml","quality_thresholds","",pending,"Deliberately cannot be automated before outcome-blind missingness review"
"Final eligible cohort freeze is not performed","README.md; PHASE_STATUS.md","Current scope; Full cohort and later research","GovernanceTests.test_readme_scope_is_phase_limited",blocked_by_protocol,"Non-execution is verified only for the present workspace state"
"Train validation test split and test access are not performed","README.md","Current scope","GovernanceTests.test_readme_scope_is_phase_limited",blocked_by_protocol,"No split implementation exists in the repository"
"Phase 5A performs no full signal download","README.md; data/manifests/metadata_audit_source_snapshot.json","Current scope; Phase 5A endpoint scope","FullMetadataAuditArtifactTests.test_source_snapshots_and_scope_are_phase5a_only",implemented,"Phase 5A queried only /cases and /trks; later Phase 5C and human-approved Phase 6A acquisitions are separately bounded"
"Force push history rewrite and modification of the legacy repository are prohibited","PHASE_STATUS.md","Phase gate policy","",pending,"Operational conduct is not honestly provable by a repository unit test"
"Phase 5B reports anesthesia operation emergency age adult and ASA descriptors for all 6388 cases","data/manifests/eligibility_decision_support_summary.json; docs/decision_support_report.md","full_manifest_descriptive; Full 6,388-case clinical descriptors","EligibilityDecisionSupportArtifactTests.test_full_manifest_descriptors_recompute_without_outcomes",implemented,"The test recomputes source-value frequencies age range and ASA missingness from the complete Phase 5A manifest without reading outcomes"
"Phase 5B semantic review is limited to requested research-relevant names","src/vitaldb_state_selection/cohort/decision_support.py; data/manifests/research_relevant_unapproved_tracks.csv","RELEVANT_TRACK_SPECS; narrow track review","EligibilityDecisionSupportArtifactTests.test_relevant_track_review_is_narrow_pending_and_unmerged",implemented,"Exactly 21 names are reviewed; the other 172 Phase 5A unapproved names are not semantically classified"
"The 3289 exact-primary cases have the requested descriptive crosstabs and joint counts","data/manifests/eligibility_decision_support_summary.json; data/manifests/research_relevant_track_presence.csv","exact_primary_subset","EligibilityDecisionSupportArtifactTests.test_exact_primary_subset_and_requested_crosstabs_recompute",implemented,"The test independently joins full presence rows to the Phase 5A manifest and checks all requested presence dimensions and combination totals"
"Official RATE label and unit evidence is recorded without final unit approval or RFTN20 RFTN50 merging","src/vitaldb_state_selection/cohort/decision_support.py; data/manifests/eligibility_decision_support_summary.json; configs/track_aliases.yaml","RATE_DOCUMENTATION; rate_and_label_primary_source_review; unit_status","EligibilityDecisionSupportArtifactTests.test_rate_evidence_does_not_change_alias_configuration",implemented,"The automated test verifies the recorded evidence and unchanged pending status; it does not claim to automate the human assessment of the external primary source"
"Eligibility scenarios are compared descriptively and no rule is selected","data/manifests/eligibility_decision_support_summary.json; docs/decision_support_report.md","eligibility_scenarios; Eligibility scenarios — comparison only","EligibilityDecisionSupportArtifactTests.test_scenarios_are_unselected_and_exclusions_balance",implemented,"Sequential exclusion counts balance to 6388 while selected_scenario remains null"
"Phase 5B rechecks only track metadata with source checksum and no raw signal or legacy ID access","data/manifests/eligibility_decision_support_source_snapshot.json; data/manifests/eligibility_decision_support_failures.jsonl","endpoint; scope; prohibited_execution","EligibilityDecisionSupportArtifactTests.test_source_snapshot_is_metadata_only_and_matches_phase5a",implemented,"The /trks checksum matches Phase 5A and all prohibited execution flags remain false; legacy repository read-only conduct remains a separate manual check"
"Phase 5B outputs have a machine-readable summary report and verified artifact checksums","data/manifests/eligibility_decision_support_summary.json; data/manifests/eligibility_decision_support_artifact_checksums.json; docs/decision_support_report.md","Summary root; artifact checksum inventory; report boundaries","EligibilityDecisionSupportArtifactTests.test_report_boundaries_and_artifact_checksums",implemented,"Checksums cover the report summary source snapshot failure log relevant-name table and full case-level presence table"
"Phase 5C uses exactly the unfrozen 3219-case adult exact-General exact-primary universe","data/manifests/volatile_signal_case_manifest.csv; data/manifests/volatile_signal_characterization_summary.json","analysis_universe; 3219 case rows","VolatileCharacterizationArtifactTests.test_analysis_universe_recomputes_to_exactly_3219_without_freeze",implemented,"The test independently recomputes the universe from the complete Phase 5A manifest; final eligibility and legacy overlap remain pending"
"Phase 5C requests only the seven authorized exact volatile tracks","scripts/run_volatile_characterization.py; src/vitaldb_state_selection/cohort/volatile_characterization.py; data/manifests/volatile_signal_source_snapshot.json","VOLATILE_TRACKS; allowed_exact_track_names; other_raw_track_requests","VolatileCharacterizationTests.test_allowed_signal_scope_is_exactly_the_seven_requested_tracks",implemented,"BIS propofol remifentanil CP CE and VOL signals are outside the executable allowlist"
"A fixed-seed presence-stratified preflight must pass the operational and two-times disk-space gates before full characterization","data/manifests/volatile_signal_preflight_summary.json; docs/volatile_signal_preflight_report.md","seed 20260720; strata estimates; full_download_authorized_by_gate","VolatileCharacterizationArtifactTests.test_preflight_is_fixed_seed_stratified_and_passes_two_x_disk_gate",implemented,"Twenty cases cover all ten exact presence combinations; the gate uses measured bytes and request time without making a scientific inference"
"All 3219 cases and all seven exact tracks have explicit rows including absence empty parsing and API failures","data/manifests/volatile_signal_case_manifest.csv; data/manifests/volatile_signal_track_manifest.csv; data/manifests/volatile_signal_failures.jsonl","3219 case rows; 22533 case-track rows; download_status and failure fields","VolatileCharacterizationArtifactTests.test_case_track_matrix_is_complete_exact_and_failure_explicit",implemented,"The completed run had 9059 complete downloads and 13474 explicit track-absent rows; the failure log is retained and empty because no download or parsing failure occurred"
"Volatile summaries use original timestamps without resampling interpolation smoothing clipping or abnormal-value deletion","src/vitaldb_state_selection/cohort/volatile_characterization.py; data/manifests/volatile_signal_track_manifest.csv; data/manifests/volatile_signal_characterization_summary.json","parse_signal_payload; processing","VolatileCharacterizationTests.test_parser_uses_original_rows_without_resampling_or_clipping",implemented,"Warning flags are stored separately; positive runs follow consecutive recorded observations rather than an invented sampling grid"
"Raw volatile downloads are atomic resumable checksum-verified and never committed","src/vitaldb_state_selection/cohort/volatile_characterization.py; .gitignore; data/manifests/volatile_signal_track_manifest.csv","download_one_task; load_verified_metadata; data/raw ignore","VolatileCharacterizationArtifactTests.test_every_downloaded_raw_file_matches_manifest_checksum_and_no_partials_remain",implemented,"All 9059 signal payloads are rehashed from the ignored raw root; a separate artifact test verifies Git tracks no data/raw file"
"Phase 5C reports distributions combinations boundary samples and unselected exposure-definition counts outcome-blind","data/manifests/volatile_signal_characterization_summary.json; docs/volatile_signal_decision_support_report.md","track_summaries; presence and positive-recording combinations; manual_review_boundary_samples; possible_exposure_definition_counts","VolatileCharacterizationArtifactTests.test_summary_recomputes_track_and_candidate_definition_counts",implemented,"Track presence and value greater than zero are descriptive observations only; selected_exposure_definition remains null"
"Official volatile track descriptions and documentary units do not become final alias or unit approvals","src/vitaldb_state_selection/cohort/volatile_characterization.py; data/manifests/volatile_signal_source_snapshot.json; configs/track_aliases.yaml","VOLATILE_TRACKS; official_track_documentation; approval_status","VolatileCharacterizationArtifactTests.test_source_scope_contains_only_allowed_raw_tracks_and_no_downstream_work",implemented,"The test verifies pending_human_review and unchanged versioned configuration; it does not claim to automate human validation of the external primary source"
"Phase 5C does not access legacy 98 IDs freeze a cohort or execute downstream research","data/manifests/volatile_signal_source_snapshot.json; data/manifests/volatile_signal_case_manifest.csv; PHASE_STATUS.md","scope; prohibited_execution; pending decisions","VolatileCharacterizationArtifactTests.test_source_scope_contains_only_allowed_raw_tracks_and_no_downstream_work",implemented,"Legacy repository read-only conduct is also checked manually against its preserved commit tree and pre-existing status"
"Protocol v1.1 fixes the primary pre-quality universe and reuses the Phase 5D 10-second method without changing it","docs/protocol_v1_1_decision_record.md; src/vitaldb_state_selection/cohort/primary_acquisition.py; data/manifests/pre_quality_acquisition_cohort.csv","Metadata universe; Primary volatile exclusion; build_pre_quality_manifest","PrimaryAcquisitionArtifactTests.test_pre_quality_cohort_accounts_for_3219_once_and_preserves_reasons",implemented,"All 3219 cases appear once; 674 volatile exclusions and case 4476 invalid-window exclusion are separate flags and multiple reasons are preserved"
"Legacy overlap uses only the exact actual-use 98 case IDs and preserves read-only provenance","data/manifests/primary_signal_source_snapshot.json; data/manifests/pre_quality_acquisition_cohort.csv","legacy_overlap_provenance; legacy_98_overlap","PrimaryAcquisitionArtifactTests.test_legacy_provenance_is_minimal_exact_and_read_only",implemented,"The three caseid-only artifacts total 98 unique IDs; split labels results metrics and first-100 recomputation are explicitly false; external read-only conduct is recorded as before/after evidence"
"The Phase 6A preflight is a fixed-seed random 25-case sample and gates full acquisition on structure and two-times disk space","data/manifests/primary_signal_preflight_summary.json; docs/primary_signal_preflight_report.md","selection_method; disk and operational gates","PrimaryAcquisitionArtifactTests.test_preflight_is_fixed_random_25_and_passes_both_gates",implemented,"All 100 present sample requests completed and both gates passed; the sample is not the first 25 included cases"
"Primary acquisition requests exactly four approved tracks for every included case and keeps BIS/SQI QC-only","src/vitaldb_state_selection/cohort/primary_acquisition.py; data/manifests/primary_signal_download_manifest.csv; configs/track_aliases.yaml","PRIMARY_TRACKS; case-track rows; qc_only_exact_tracks","PrimaryAcquisitionArtifactTests.test_download_matrix_is_complete_exact_and_sqi_is_qc_only",implemented,"2470 included cases have 9880 unique rows; BIS/SQI is prohibited as prediction feature and PPO state; RFTN50 is not merged or used"
